{"activation_expectation":"required","allowed_candidate_globs":["src/**"],"base_ref":"task-packs/open-coding-ts-ledger-v1/base","bucket":"trigger","effective_base_sha256":"c3627bf66ad2d3df607d2264728b6b1f0409857b714a37dbffd13b71772ddbd5","forbidden_entry_types":["symlink","submodule"],"oracle":{"behavior_keys":["basic_reservation","idempotent_replay","conflicting_replay_rejected","no_oversubscription_concurrent","terminal_transition_idempotency","restart_recovery","corrupt_state_fail_closed","deterministic_snapshot"],"runner_ref":"task-packs/open-coding-ts-ledger-v1/oracle/runner.mjs","runner_sha256":"d3b822aa660572b874d175cc62772797f5c5bc577be871908668f0aed038eea1","version":"ledger-oracle-v3"},"overlays":[],"public_task_ref":"task-packs/open-coding-ts-ledger-v1/public-task.md","public_task_sha256":"9074f43d9722bc32185a5ac42ca32cf550c378768c5ce979b5f06f3f1c65358f","schema_version":1,"task_id":"ledger-full-v1"}
