{"activation_expectation":"observed","allowed_candidate_globs":["src/**"],"base_ref":"task-packs/open-coding-ts-ledger-v1/base","bucket":"holdout","effective_base_sha256":"6eec4b91004b131792e804d22e5b8933ea8cfa7be4bc51d3f4ea95f07ba8b23c","forbidden_entry_types":["symlink","submodule"],"oracle":{"behavior_keys":["basic_reservation","idempotent_replay","conflicting_replay_rejected","no_oversubscription_concurrent","terminal_transition_idempotency","restart_recovery","corrupt_state_fail_closed","deterministic_snapshot"],"runner_ref":"task-packs/open-coding-ts-ledger-v1/oracle/runner.mjs","runner_sha256":"d3b822aa660572b874d175cc62772797f5c5bc577be871908668f0aed038eea1","version":"ledger-oracle-v3"},"overlays":[{"source_ref":"task-packs/open-coding-ts-ledger-v1/calibration/mutant-release-not-persisted/src/ledger.ts","target_ref":"src/ledger.ts"}],"public_task_ref":"eval-packs/open-coding-goal-v1/tasks/ledger-release-recovery.md","public_task_sha256":"e7cb4387003a9e6f202ecd908d139596c65b91f599e15803307050694d42ab5e","schema_version":1,"task_id":"ledger-release-recovery-v1"}
