{"activation_expectation":"observed","allowed_candidate_globs":["src/**"],"base_ref":"task-packs/open-coding-ts-ledger-v1/base","bucket":"holdout","effective_base_sha256":"c7d61935d5f71061eba26e670257df6c45c6d0bb162bd1bfded74d58f928eeef","forbidden_entry_types":["symlink","submodule"],"oracle":{"behavior_keys":["basic_reservation","idempotent_replay","conflicting_replay_rejected","no_oversubscription_concurrent","terminal_transition_idempotency","restart_recovery","corrupt_state_fail_closed","deterministic_snapshot"],"runner_ref":"task-packs/open-coding-ts-ledger-v1/oracle/runner.mjs","runner_sha256":"d3b822aa660572b874d175cc62772797f5c5bc577be871908668f0aed038eea1","version":"ledger-oracle-v3"},"overlays":[{"source_ref":"task-packs/open-coding-ts-ledger-v1/calibration/mutant-no-persistence/src/ledger.ts","target_ref":"src/ledger.ts"}],"public_task_ref":"eval-packs/open-coding-goal-v1/tasks/ledger-restart-recovery.md","public_task_sha256":"031ac8d0241a33b61561cfb8128c31c370c6da9f08772a051f5fd720fa95c6e5","schema_version":1,"task_id":"ledger-restart-recovery-v1"}
